{"project_id":"mangadistrict-com-title-stupidemic-uncensored","chapter_id":"ch-200c8c840df0","page_index":27,"context_version":"smoke:no-canonical-context","blocks":[{"block_id":"p027-b001","speaker_id":null,"source_text":"ARE YOU RUNNING AN ERRAND FOR AEYEONG?","translation":"Cậu đang chạy việc cho Aeyeong à?","speaker_confidence":null,"translation_confidence":0.97,"notes":"Dialogue; name spelling copied from source."},{"block_id":"p027-b002","speaker_id":null,"source_text":"OH, YES...","translation":"À, vâng...","speaker_confidence":null,"translation_confidence":0.99,"notes":"Dialogue."},{"block_id":"p027-b003","speaker_id":null,"source_text":"TILT","translation":"Nghiêng","speaker_confidence":null,"translation_confidence":0.95,"notes":"Body/head movement effect."},{"block_id":"p027-b004","speaker_id":null,"source_text":"OH, AEYEONG... SHE REALLY WANTS TO BE ONE OF US, THE OFFICE WORKERS.","translation":"À, Aeyeong... cô ấy thật sự muốn trở thành một trong số bọn tôi, dân văn phòng.","speaker_confidence":null,"translation_confidence":0.97,"notes":"Dialogue."},{"block_id":"p027-b005","speaker_id":null,"source_text":"OH, UM... DO WE SUDDENLY BECOME AN OFFICE WORKER IF WE USE THE WATER PURIFIER HERE?","translation":"Ơ, ừm... cứ dùng máy lọc nước ở đây là tự nhiên thành nhân viên văn phòng à?","speaker_confidence":null,"translation_confidence":0.98,"notes":"Dialogue."},{"block_id":"p027-b006","speaker_id":null,"source_text":"SHE MUST REALLY LOVE THE OFFICE.","translation":"Chắc chị ấy mê văn phòng lắm.","speaker_confidence":null,"translation_confidence":0.97,"notes":"Internal narration."},{"block_id":"p027-b007","speaker_id":null,"source_text":"THERE SHOULD BE A DISTINCTION.","translation":"Phải có sự phân biệt chứ.","speaker_confidence":null,"translation_confidence":0.98,"notes":"Dialogue."},{"block_id":"p027-b008","speaker_id":null,"source_text":"SOMEONE WHO WORKS OUTSIDE... ISN'T THE SAME AS SOMEONE WHO WORKS INSIDE.","translation":"Người làm ngoài công trường... đâu giống người làm trong văn phòng.","speaker_confidence":null,"translation_confidence":0.98,"notes":"Dialogue."},{"block_id":"p027-b009","speaker_id":null,"source_text":"GRAB","translation":"Nắm","speaker_confidence":null,"translation_confidence":0.95,"notes":"Grabbing/motion effect."}]}