{
  "project_id": "mangadistrict-com-title-stupidemic-uncensored",
  "chapter_id": "ch-200c8c840df0",
  "page_index": 10,
  "context_version": "smoke:no-canonical-context",
  "blocks": [
    {
      "block_id": "p010-b001",
      "speaker_id": null,
      "source_text": "OH, FOR FUCK'S SAKE. JUST BECAUSE YOU HAVE BOOBS, DOESN'T MEAN YOU'RE A WOMAN. ALSO, SHE HAS A POTTY MOUTH THAT ONLY KNOWS HOW TO SWEAR.",
      "translation": "Ôi, đéo chịu nổi. Có ngực không có nghĩa là đàn bà đâu. Với lại, mồm bà ta bẩn lắm, mở ra chỉ biết chửi.",
      "speaker_confidence": 0.78,
      "translation_confidence": 0.96,
      "notes": "Insulting/profane register preserved."
    },
    {
      "block_id": "p010-b002",
      "speaker_id": null,
      "source_text": "DON'T GO FUCKING ANY GIRL YOU CAN FIND. YOU MIGHT GET SICK.",
      "translation": "Đừng thấy con gái nào cũng đòi địt. Có ngày dính bệnh đấy.",
      "speaker_confidence": 0.78,
      "translation_confidence": 0.97,
      "notes": "Crude warning preserved."
    },
    {
      "block_id": "p010-b003",
      "speaker_id": null,
      "source_text": "WOW, BUT IF I KNEW I'D NEVER GET FIRED NO MATTER WHAT I DO, I WOULD'VE TRIED TO FUCK HER.",
      "translation": "Wow, nhưng nếu tôi biết làm gì cũng không bị đuổi thì tôi đã thử địt bà ấy rồi.",
      "speaker_confidence": 0.78,
      "translation_confidence": 0.96,
      "notes": "Explicit vulgarity preserved from source."
    },
    {
      "block_id": "p010-b004",
      "speaker_id": null,
      "source_text": "WHO SAYS I'LL SLEEP WITH IDIOTS LIKE YOU TWO?",
      "translation": "Ai bảo tôi sẽ ngủ với hai thằng ngu các cậu hả?",
      "speaker_confidence": 0.86,
      "translation_confidence": 0.98,
      "notes": "Visible female speaker; dialogue later addresses her as Miss Kim, but no canonical speaker ID exists in smoke context."
    },
    {
      "block_id": "p010-b005",
      "speaker_id": null,
      "source_text": "YOU IMBECILES ONLY KNOW HOW TO DREAM BIG. AND WHAT THE FUCK ARE YOU DOING HERE DURING WORKING HOURS?",
      "translation": "Hai thằng đần các cậu chỉ giỏi mơ mộng. Mà trong giờ làm việc các cậu đang làm cái quái gì ở đây?",
      "speaker_confidence": 0.86,
      "translation_confidence": 0.98,
      "notes": "Same visible female speaker."
    },
    {
      "block_id": "p010-b006",
      "speaker_id": null,
      "source_text": "MISS KIM. WHAT BRINGS YOU OUT HERE?",
      "translation": "Cô Kim, sao cô lại ra tận đây?",
      "speaker_confidence": 0.82,
      "translation_confidence": 0.99,
      "notes": "Name/title is explicit in dialogue; canonical character ID not available."
    },
    {
      "block_id": "p010-b007",
      "speaker_id": null,
      "source_text": "YOU SHOULD'VE CALLED ME.",
      "translation": "Lẽ ra cô nên gọi tôi.",
      "speaker_confidence": 0.82,
      "translation_confidence": 0.99,
      "notes": null
    },
    {
      "block_id": "p010-b008",
      "speaker_id": null,
      "source_text": "SPRING",
      "translation": "Bật",
      "speaker_confidence": null,
      "translation_confidence": 0.72,
      "notes": "Visible movement sound effect; exact physical action is not fully clear."
    }
  ]
}
