{"project_id":"mangadistrict-com-title-stupidemic-uncensored","chapter_id":"ch-200c8c840df0","page_index":30,"context_version":"smoke:no-canonical-context","blocks":[{"block_id":"p030-b001","speaker_id":null,"source_text":"WHAT? WHAT ARE YOU TALKING ABOUT?","translation":"Hả? Cô đang nói gì vậy?","speaker_confidence":null,"translation_confidence":0.99,"notes":"Dialogue."},{"block_id":"p030-b002","speaker_id":null,"source_text":"I PUT THE COFFEE POWDER IN AS USUAL AND ADDED HOT WATER...","translation":"Tôi cho bột cà phê vào như bình thường rồi thêm nước nóng...","speaker_confidence":null,"translation_confidence":0.99,"notes":"Dialogue."},{"block_id":"p030-b003","speaker_id":null,"source_text":"WHAT'S WRONG WITH HER?","translation":"Cô ta bị gì vậy?","speaker_confidence":null,"translation_confidence":0.98,"notes":"Internal narration."},{"block_id":"p030-b004","speaker_id":null,"source_text":"YOU'VE ADDED HOT WATER BEFORE?","translation":"Trước giờ cậu vẫn cho nước nóng vào à?","speaker_confidence":null,"translation_confidence":0.99,"notes":"Dialogue."},{"block_id":"p030-b005","speaker_id":null,"source_text":"WHY ARE YOU SO PROUD ABOUT SABOTAGING MY DRINKS?","translation":"Sao cậu còn vênh váo vì phá đồ uống của tôi thế?","speaker_confidence":null,"translation_confidence":0.97,"notes":"Dialogue."},{"block_id":"p030-b006","speaker_id":null,"source_text":"???","translation":"???","speaker_confidence":null,"translation_confidence":0.99,"notes":"Visible confusion marker."},{"block_id":"p030-b007","speaker_id":null,"source_text":"WHY WOULDN'T YOU ADD WATER TO COFFEE POWDER?","translation":"Bột cà phê thì sao lại không cho nước?","speaker_confidence":null,"translation_confidence":0.99,"notes":"Dialogue."}]}