{"project_id":"mangadistrict-com-title-stupidemic-uncensored","chapter_id":"ch-200c8c840df0","page_index":41,"context_version":"smoke:no-canonical-context","blocks":[{"block_id":"p041-b001","speaker_id":null,"source_text":"THIS BITCH HAS THE VIRUS. KEKEKE.","translation":"Con mụ này nhiễm virus thật rồi. Khà khà.","speaker_confidence":null,"translation_confidence":0.98,"notes":"Internal narration; crude insult and laughter preserved. End-of-chapter title/credit graphics are not treated as translation dialogue blocks."}]}