{"project_id":"mangadistrict-com-title-stupidemic-uncensored","chapter_id":"ch-200c8c840df0","page_index":29,"context_version":"smoke:no-canonical-context","blocks":[{"block_id":"p029-b001","speaker_id":null,"source_text":"HMM... BUT SHE WAS TALKING TO ME WITH A BIG SMILE ON HER FACE. I DON'T THINK SHE SAID ANYTHING OFFENSIVE.","translation":"Hmm... nhưng chị ấy nói chuyện với mình bằng nụ cười rất tươi. Chắc đâu có ý xúc phạm gì.","speaker_confidence":null,"translation_confidence":0.97,"notes":"Internal narration."},{"block_id":"p029-b002","speaker_id":null,"source_text":"CLACK","translation":"Cạch","speaker_confidence":null,"translation_confidence":0.96,"notes":"Cup placement sound effect."},{"block_id":"p029-b003","speaker_id":null,"source_text":"WHY ARE YOU SO LATE?","translation":"Sao giờ mới về?","speaker_confidence":null,"translation_confidence":0.99,"notes":"Dialogue."},{"block_id":"p029-b004","speaker_id":null,"source_text":"DID YOU MAKE COFFEE OR SOMETHING?","translation":"Cậu đi pha cà phê hay gì mà lâu thế?","speaker_confidence":null,"translation_confidence":0.98,"notes":"Dialogue."},{"block_id":"p029-b005","speaker_id":null,"source_text":"THE WATER PURIFIER WASN'T WORKING PROPERLY, SO I WAS LATE.","translation":"Máy lọc nước hoạt động không ổn nên tôi mới chậm.","speaker_confidence":null,"translation_confidence":0.98,"notes":"Dialogue."},{"block_id":"p029-b006","speaker_id":null,"source_text":"HUH? WHY DO YOU NEED WATER FOR COFFEE?","translation":"Hả? Pha cà phê thì cần nước làm gì?","speaker_confidence":null,"translation_confidence":0.99,"notes":"Dialogue; odd premise preserved literally."},{"block_id":"p029-b007","speaker_id":null,"source_text":"WHY AREN'T YOU ASHAMED THAT YOU WERE JUST WASTING TIME?","translation":"Cậu không thấy xấu hổ vì vừa lãng phí thời gian à?","speaker_confidence":null,"translation_confidence":0.98,"notes":"Dialogue."}]}