{"project_id":"mangadistrict-com-title-stupidemic-uncensored","chapter_id":"ch-200c8c840df0","page_index":32,"context_version":"smoke:no-canonical-context","blocks":[{"block_id":"p032-b001","speaker_id":null,"source_text":"ARE YOU STUPID?","translation":"Cậu ngu à?","speaker_confidence":null,"translation_confidence":0.99,"notes":"Dialogue."},{"block_id":"p032-b002","speaker_id":null,"source_text":"DO YOU ADD WATER TO SODA TOO?","translation":"Cậu cũng đổ nước vào nước ngọt à?","speaker_confidence":null,"translation_confidence":0.99,"notes":"Dialogue."},{"block_id":"p032-b003","speaker_id":null,"source_text":"WHAT...?","translation":"Hả...?","speaker_confidence":null,"translation_confidence":0.99,"notes":"Dialogue/reaction."},{"block_id":"p032-b004","speaker_id":null,"source_text":"YOU DON'T EVEN SEEM ASHAMED FOR MESSING WITH MY DRINK.","translation":"Cậu phá đồ uống của tôi mà còn chẳng biết xấu hổ.","speaker_confidence":null,"translation_confidence":0.98,"notes":"Dialogue."},{"block_id":"p032-b005","speaker_id":null,"source_text":"IS THAT HOW YOUR MOM TAUGHT YOU?","translation":"Mẹ cậu dạy cậu như thế à?","speaker_confidence":null,"translation_confidence":0.99,"notes":"Dialogue."},{"block_id":"p032-b006","speaker_id":null,"source_text":"SHE'S REALLY CROSSING THE LINE TODAY.","translation":"Hôm nay cô ta thật sự quá giới hạn rồi.","speaker_confidence":null,"translation_confidence":0.98,"notes":"Internal narration."}]}