{"project_id":"mangadistrict-com-title-stupidemic-uncensored","chapter_id":"ch-200c8c840df0","page_index":31,"context_version":"smoke:no-canonical-context","blocks":[{"block_id":"p031-b001","speaker_id":null,"source_text":"WHY WOULD YOU ADD WATER?","translation":"Sao lại cho nước vào?","speaker_confidence":null,"translation_confidence":0.99,"notes":"Dialogue."},{"block_id":"p031-b002","speaker_id":null,"source_text":"WHY ARE YOU EVEN MESSING WITH MY DRINKS?","translation":"Sao cậu còn dám nghịch đồ uống của tôi?","speaker_confidence":null,"translation_confidence":0.98,"notes":"Dialogue."},{"block_id":"p031-b003","speaker_id":null,"source_text":"NOW, SHE'S COME TO A POINT WHERE SHE JUST BITCHES OVER NOTHING?","translation":"Giờ cô ta tới mức kiếm chuyện chửi bới vô cớ luôn à?","speaker_confidence":null,"translation_confidence":0.97,"notes":"Internal narration; crude wording preserved."},{"block_id":"p031-b004","speaker_id":null,"source_text":"SIGH","translation":"Thở dài","speaker_confidence":null,"translation_confidence":0.97,"notes":"Sigh sound/effect."},{"block_id":"p031-b005","speaker_id":null,"source_text":"SHE WANTS A FIGHT, HUH?","translation":"Muốn gây sự chứ gì?","speaker_confidence":null,"translation_confidence":0.98,"notes":"Internal narration."},{"block_id":"p031-b006","speaker_id":null,"source_text":"HAA...","translation":"Ha...","speaker_confidence":null,"translation_confidence":0.99,"notes":"Spoken sigh."},{"block_id":"p031-b007","speaker_id":null,"source_text":"NOW, YOU'RE MAKING THINGS UP SO YOU CAN TREAT ME LIKE I'M YOUR BITCH?","translation":"Giờ cô bịa chuyện để đối xử với tôi như con chó của cô à?","speaker_confidence":null,"translation_confidence":0.96,"notes":"Dialogue; degrading slang preserved rather than softened."},{"block_id":"p031-b008","speaker_id":null,"source_text":"MAKE THINGS UP?","translation":"Bịa chuyện?","speaker_confidence":null,"translation_confidence":0.99,"notes":"Dialogue; continuation begins here and carries into page 32."}]}