{
  "project_id": "mangadistrict-com-title-stupidemic-uncensored",
  "chapter_id": "ch-200c8c840df0",
  "page_index": 15,
  "context_version": "smoke:no-canonical-context",
  "blocks": [
    {
      "block_id": "p015-b001",
      "speaker_id": null,
      "source_text": "ONE GOING THROUGH ALL THE TROUBLE...",
      "translation": "...người phải chịu mọi phiền phức đây này...",
      "speaker_confidence": 0.9,
      "translation_confidence": 0.96,
      "notes": "Continuation of page-14 fragment 'I'M THE'."
    },
    {
      "block_id": "p015-b002",
      "speaker_id": null,
      "source_text": "THANK YOU FOR EVERYTHING.",
      "translation": "Cảm ơn cô vì tất cả.",
      "speaker_confidence": 0.82,
      "translation_confidence": 0.99,
      "notes": "Visible male speaker."
    },
    {
      "block_id": "p015-b003",
      "speaker_id": null,
      "source_text": "DO YOU EVEN KNOW HOW TO USE YOUR BRAIN?",
      "translation": "Anh có biết dùng não không vậy?",
      "speaker_confidence": 0.9,
      "translation_confidence": 0.99,
      "notes": "Visible female speaker."
    },
    {
      "block_id": "p015-b004",
      "speaker_id": null,
      "source_text": "I'M NOT SURE.",
      "translation": "Tôi cũng không chắc.",
      "speaker_confidence": 0.82,
      "translation_confidence": 0.99,
      "notes": "Deadpan reply from visible male speaker."
    },
    {
      "block_id": "p015-b005",
      "speaker_id": null,
      "source_text": "YOU SHOULD SAVE UP YOUR SALARY WHEN YOU GET PAID.",
      "translation": "Lúc nhận lương thì nhớ tiết kiệm lại đi.",
      "speaker_confidence": 0.9,
      "translation_confidence": 0.98,
      "notes": null
    },
    {
      "block_id": "p015-b006",
      "speaker_id": null,
      "source_text": "TURN",
      "translation": "Quay người",
      "speaker_confidence": null,
      "translation_confidence": 0.86,
      "notes": "Visible movement effect as the female character turns away."
    },
    {
      "block_id": "p015-b007",
      "speaker_id": null,
      "source_text": "BECAUSE YOU GET PAID THE SAME AMOUNT OF MONEY AS EVERYBODY ELSE EVEN THOUGH YOU ARE A FUCKING IDIOT.",
      "translation": "Vì dù anh là một thằng ngu chết tiệt, anh vẫn được trả lương ngang với mọi người.",
      "speaker_confidence": 0.9,
      "translation_confidence": 0.98,
      "notes": "Insulting/profane register preserved."
    },
    {
      "block_id": "p015-b008",
      "speaker_id": null,
      "source_text": "GET BACK TO WORK. WASH MY CUP AND FILL IT UP WITH COFFEE ON YOUR WAY BACK.",
      "translation": "Quay lại làm việc đi. Trên đường về nhớ rửa cốc của tôi rồi rót đầy cà phê.",
      "speaker_confidence": 0.9,
      "translation_confidence": 0.98,
      "notes": null
    }
  ]
}
