{"project_id":"mangadistrict-com-title-stupidemic-uncensored","chapter_id":"ch-200c8c840df0","page_index":26,"context_version":"smoke:no-canonical-context","blocks":[{"block_id":"p026-b001","speaker_id":null,"source_text":"STEP","translation":"Bước","speaker_confidence":null,"translation_confidence":0.95,"notes":"Footstep effect."},{"block_id":"p026-b002","speaker_id":null,"source_text":"HMM? DAEHO? ARE YOU USING THE WATER PURIFIER?","translation":"Hửm? Daeho? Cậu đang dùng máy lọc nước à?","speaker_confidence":null,"translation_confidence":0.98,"notes":"Dialogue."},{"block_id":"p026-b003","speaker_id":null,"source_text":"BUT THIS IS FOR THE OFFICE WORKERS.","translation":"Nhưng cái này dành cho nhân viên văn phòng mà.","speaker_confidence":null,"translation_confidence":0.99,"notes":"Dialogue."},{"block_id":"p026-b004","speaker_id":null,"source_text":"IT'S THE ACCOUNTANT. I GET LUCKY THE ENTIRE DAY WHEN I SEE HER.","translation":"Là chị kế toán. Cứ gặp chị ấy là cả ngày mình gặp may.","speaker_confidence":null,"translation_confidence":0.97,"notes":"Internal narration; exact job-title register is provisional."},{"block_id":"p026-b005","speaker_id":null,"source_text":"OH, HOT WATER'S NOT COMING OUT OF OUR WATER PURIFIER ON-SITE, THAT'S WHY.","translation":"À, máy lọc nước bên công trường không ra nước nóng nên tôi mới qua đây.","speaker_confidence":null,"translation_confidence":0.98,"notes":"Dialogue."},{"block_id":"p026-b006","speaker_id":null,"source_text":"I SEE. YOU SHOULD GET IT FIXED.","translation":"Ra vậy. Cậu nên sửa nó đi.","speaker_confidence":null,"translation_confidence":0.99,"notes":"Dialogue."},{"block_id":"p026-b007","speaker_id":null,"source_text":"I WONDER WHAT KIND OF LUCKY THINGS WILL HAPPEN TO ME TODAY.","translation":"Không biết hôm nay mình sẽ gặp may kiểu gì đây.","speaker_confidence":null,"translation_confidence":0.98,"notes":"Internal narration."}]}