{"project_id":"mangadistrict-com-title-stupidemic-uncensored","chapter_id":"ch-200c8c840df0","page_index":23,"context_version":"smoke:no-canonical-context","blocks":[{"block_id":"p023-b001","speaker_id":null,"source_text":"DAMN...! UNCLE!!! YOUR NEPHEW, DAEHO LEE, WILL MULTIPLY THIS MONEY AND PAY BACK HIS DEBTS ON HIS OWN!","translation":"Chết tiệt...! Chú ơi!!! Thằng cháu Lee Daeho này sẽ nhân số tiền ấy lên rồi tự tay trả hết nợ!","speaker_confidence":null,"translation_confidence":0.96,"notes":"Internal exclamation; kinship term remains provisional."},{"block_id":"p023-b002","speaker_id":null,"source_text":"WHAT SHOULD I DO? SHOULD I JUST BET A HUNDRED BUCKS?","translation":"Làm sao đây? Hay cược 100 đô thôi?","speaker_confidence":null,"translation_confidence":0.98,"notes":"Internal narration."},{"block_id":"p023-b003","speaker_id":null,"source_text":"BUT I GET TWO TIMES THE AMOUNT IF I GET IT RIGHT. SHOULD I GO FOR A THOUSAND BUCKS?","translation":"Nhưng đoán đúng thì tiền nhân đôi. Hay chơi luôn 1.000 đô?","speaker_confidence":null,"translation_confidence":0.98,"notes":"Internal narration."},{"block_id":"p023-b004","speaker_id":null,"source_text":"YOU DON'T EVEN HAVE A THOUSAND BUCKS.","translation":"Mày còn chẳng có nổi 1.000 đô.","speaker_confidence":null,"translation_confidence":0.97,"notes":"Self-directed internal narration."},{"block_id":"p023-b005","speaker_id":null,"source_text":"I'M GOING TO PLAY IT SAFE AND GO FOR A HUNDRED BUCKS! EVEN THIS WILL BECOME TWO HUNDRED BUCKS IF I GET IT RIGHT.","translation":"Cứ an toàn, cược 100 đô thôi! Đúng thì 100 cũng thành 200 mà.","speaker_confidence":null,"translation_confidence":0.98,"notes":"Internal narration."},{"block_id":"p023-b006","speaker_id":null,"source_text":"KEKEKEKE","translation":"Khà khà khà","speaker_confidence":null,"translation_confidence":0.96,"notes":"Laughter effect; repeated instances represented by one block."},{"block_id":"p023-b007","speaker_id":null,"source_text":"TAP","translation":"Chạm","speaker_confidence":null,"translation_confidence":0.96,"notes":"Touchscreen sound effect."},{"block_id":"p023-b008","speaker_id":null,"source_text":"WIN!","translation":"THẮNG!","speaker_confidence":null,"translation_confidence":0.99,"notes":"Game UI result text."}]}