{"project_id":"mangadistrict-com-title-stupidemic-uncensored","chapter_id":"ch-200c8c840df0","page_index":39,"context_version":"smoke:no-canonical-context","blocks":[{"block_id":"p039-b001","speaker_id":null,"source_text":"MAYBE NOT...? SHE LOOKS NORMAL...","translation":"Chắc không...? Trông cô ta vẫn bình thường...","speaker_confidence":null,"translation_confidence":0.99,"notes":"Internal narration."},{"block_id":"p039-b002","speaker_id":null,"source_text":"NO... SHE WAS GOING ON ABOUT ME ADDING WATER TO HER COFFEE...","translation":"Không... nãy cô ta còn làm ầm lên chuyện mình cho nước vào cà phê...","speaker_confidence":null,"translation_confidence":0.98,"notes":"Internal narration."},{"block_id":"p039-b003","speaker_id":null,"source_text":"SHE'S ALSO ACTING WEIRD RIGHT NOW.","translation":"Giờ cô ta cũng đang hành xử kỳ quặc.","speaker_confidence":null,"translation_confidence":0.99,"notes":"Internal narration."},{"block_id":"p039-b004","speaker_id":null,"source_text":"IF SHE REALLY DID GET THE VIRUS...","translation":"Nếu cô ta thật sự nhiễm virus...","speaker_confidence":null,"translation_confidence":0.99,"notes":"Internal narration."},{"block_id":"p039-b005","speaker_id":null,"source_text":"MISS KIM! IT FLEW BETWEEN YOUR LEGS!!","translation":"Cô Kim! Nó bay vào giữa hai chân cô rồi!!","speaker_confidence":null,"translation_confidence":0.99,"notes":"Dialogue."},{"block_id":"p039-b006","speaker_id":null,"source_text":"W-WHAT?! WHERE?!","translation":"C-cái gì?! Ở đâu?!","speaker_confidence":null,"translation_confidence":0.99,"notes":"Dialogue."},{"block_id":"p039-b007","speaker_id":null,"source_text":"IT WENT UP YOUR...","translation":"Nó bay lên trong...","speaker_confidence":null,"translation_confidence":0.93,"notes":"Dialogue is cut off at the page boundary; continuation begins page 40."}]}