{"project_id":"mangadistrict-com-title-stupidemic-uncensored","chapter_id":"ch-200c8c840df0","page_index":38,"context_version":"smoke:no-canonical-context","blocks":[{"block_id":"p038-b001","speaker_id":null,"source_text":"W-WHAT THE HELL IS THIS ABOUT?! IS THERE REALLY A VENOMOUS MOSQUITO?","translation":"C-cái quái gì vậy?! Thật sự có muỗi độc à?","speaker_confidence":null,"translation_confidence":0.98,"notes":"Internal narration."},{"block_id":"p038-b002","speaker_id":null,"source_text":"WAIT... EVEN IF THERE IS ONE... I SMACKED THE HELL OUT OF HER CHEEK...","translation":"Khoan... dù thật sự có... mình vừa tát cô ta một cú trời giáng...","speaker_confidence":null,"translation_confidence":0.98,"notes":"Internal narration."},{"block_id":"p038-b003","speaker_id":null,"source_text":"FOOD!!! POOP!!! TITS!!!","translation":"ĐỒ ĂN!!! CỨT!!! VÚ!!!","speaker_confidence":null,"translation_confidence":0.98,"notes":"Comedic intrusive/thought text; crude wording preserved."},{"block_id":"p038-b004","speaker_id":null,"source_text":"THEY BELIEVE YOU EVEN IF YOU TELL THEM THE WORLD IS COMING TO AN END TOMORROW.","translation":"Đúng là kiểu người dù bảo ngày mai tận thế cũng tin sái cổ.","speaker_confidence":null,"translation_confidence":0.97,"notes":"Narrative aside/internal commentary."},{"block_id":"p038-b005","speaker_id":null,"source_text":"HUH...? DID SHE GET THE VIRUS?","translation":"Hả...? Cô ta nhiễm virus rồi à?","speaker_confidence":null,"translation_confidence":0.98,"notes":"Internal narration."},{"block_id":"p038-b006","speaker_id":null,"source_text":"HEY, BRING ME SOMETHING TO WIPE WITH.","translation":"Này, lấy cho tôi cái gì để lau đi.","speaker_confidence":null,"translation_confidence":0.99,"notes":"Dialogue."}]}