{"project_id":"mangadistrict-com-title-stupidemic-uncensored","chapter_id":"ch-200c8c840df0","page_index":36,"context_version":"smoke:no-canonical-context","blocks":[{"block_id":"p036-b001","speaker_id":null,"source_text":"COPS ON ME?","translation":"cảnh sát tới bắt mình à?","speaker_confidence":null,"translation_confidence":0.94,"notes":"Continuation of the cut-off internal narration from page 35."},{"block_id":"p036-b002","speaker_id":null,"source_text":"HAA... THERE'S A SECURITY CAMERA HERE... CRAP...","translation":"Ha... ở đây có camera an ninh... chết tiệt...","speaker_confidence":null,"translation_confidence":0.99,"notes":"Internal narration."},{"block_id":"p036-b003","speaker_id":null,"source_text":"I CAN'T AFFORD TO LOSE THIS JOB. WHAT AM I GOING TO DO?!","translation":"Mình không thể mất việc này. Giờ phải làm sao đây?!","speaker_confidence":null,"translation_confidence":0.99,"notes":"Internal narration."},{"block_id":"p036-b004","speaker_id":null,"source_text":"I SHOULD JUST GET ON MY KNEES AND START BEGGING!","translation":"Hay quỳ xuống van xin luôn!","speaker_confidence":null,"translation_confidence":0.98,"notes":"Internal narration."},{"block_id":"p036-b005","speaker_id":null,"source_text":"OH... HAHA! UM... IT WAS THAT NEW... WINTER MOSQUITO...!","translation":"À... ha ha! Ờm... là con... muỗi mùa đông mới xuất hiện ấy...!","speaker_confidence":null,"translation_confidence":0.96,"notes":"Dialogue; deliberately awkward excuse preserved."},{"block_id":"p036-b006","speaker_id":null,"source_text":"I HEARD THEY CAN KILL YOU! I WAS TRYING TO CATCH THAT MOSQUITO...!","translation":"Tôi nghe nói chúng có thể giết người! Tôi chỉ đang cố bắt con muỗi đó...!","speaker_confidence":null,"translation_confidence":0.98,"notes":"Dialogue."},{"block_id":"p036-b007","speaker_id":null,"source_text":"I'M SO SORRY!","translation":"Tôi xin lỗi!","speaker_confidence":null,"translation_confidence":0.99,"notes":"Dialogue."},{"block_id":"p036-b008","speaker_id":null,"source_text":"WHAT THE HELL ARE YOU SAYING, YOU IDIOT?!","translation":"Cậu đang nói cái quái gì vậy, đồ ngốc?!","speaker_confidence":null,"translation_confidence":0.99,"notes":"Dialogue."}]}