{"project_id":"mangadistrict-com-title-stupidemic-uncensored","chapter_id":"ch-200c8c840df0","page_index":24,"context_version":"smoke:no-canonical-context","blocks":[{"block_id":"p024-b001","speaker_id":null,"source_text":"UGHH!!! DAMMIT!!! I SHOULD HAVE WENT FOR A THOUSAND BUCKS!","translation":"ARGH!!! CHẾT TIỆT!!! Lẽ ra mình phải cược 1.000 đô!","speaker_confidence":null,"translation_confidence":0.99,"notes":"Internal outburst."},{"block_id":"p024-b002","speaker_id":null,"source_text":"I COULD'VE WON $2,000! I JUST LOST $1,000!","translation":"Mình đã có thể thắng 2.000 đô! Thế là vừa mất toi 1.000 đô!","speaker_confidence":null,"translation_confidence":0.98,"notes":"Internal narration; amounts preserved."},{"block_id":"p024-b003","speaker_id":null,"source_text":"VRR","translation":"Rè rè","speaker_confidence":null,"translation_confidence":0.95,"notes":"Phone-vibration effect; repeated instances represented by one block."},{"block_id":"p024-b004","speaker_id":null,"source_text":"UGH. WHO'S INTERRUPTING ME DURING MY LUCKY STREAK?","translation":"Hừ. Ai phá chuỗi may mắn của mình thế?","speaker_confidence":null,"translation_confidence":0.98,"notes":"Internal narration."},{"block_id":"p024-b005","speaker_id":null,"source_text":"DAMN BITCH. I'LL SEE ABOUT YOU.","translation":"Con mụ chết tiệt. Để xem rồi biết tay.","speaker_confidence":null,"translation_confidence":0.97,"notes":"Internal insult; crude register preserved."},{"block_id":"p024-b006","speaker_id":null,"source_text":"HEY! WHERE ARE—","translation":"Này! Cậu đang ở—","speaker_confidence":null,"translation_confidence":0.93,"notes":"Speech bubble is cut off at the page boundary and continues on page 25."}]}